{
  "schemaVersion": 1,
  "key": "record.insulating-lens",
  "displayName": "Insulating Lens",
  "mode": "modify",
  "table": "skills",
  "sourceId": 10153,
  "id": 10153,
  "values": {
    "name": "\uBCF4\uD638\uB9C9",
    "desc": "\uC790\uC2E0\uC758 \uC8FC\uBCC0\uC5D0 \uBCF4\uD638\uB9C9\uC744 \uB9CC\uB4ED\uB2C8\uB2E4\r\n#{buff_tooltip}\r\n\uBCF4\uD638\uB9C9 \uC0C1\uD0DC\uC5D0\uC11C\uB294 \uC740\uC2E0 \uAC10\uC9C0 \uAC70\uB9AC\uAC00 |cFFFF9C2750%|r \uC99D\uAC00\uB429\uB2C8\uB2E4",
    "cost": "115",
    "icon_id": "1378",
    "show": "t",
    "start_anim_id": "190",
    "fire_anim_id": "202",
    "ability_id": "7",
    "mana_cost": "0",
    "timing_id": "1",
    "weapon_slot_for_autoattack_id": "-1",
    "cooldown_time": "45000",
    "casting_time": "2000",
    "ignore_global_cooldown": "f",
    "effect_delay": "0",
    "effect_speed": "0",
    "effect_repeat_count": "1",
    "effect_repeat_tick": "0",
    "category_id": "1",
    "active_weapon_id": "0",
    "target_type_id": "0",
    "target_selection_id": "1",
    "target_relation_id": "0",
    "target_area_count": "1",
    "target_area_radius": "0",
    "target_siege": "f",
    "weapon_slot_for_angle_id": "-1",
    "target_angle": "0",
    "weapon_slot_for_range_id": "-1",
    "min_range": "0",
    "max_range": "0",
    "keep_stealth": "f",
    "stop_autoattack": "f",
    "aggro": "0",
    "fx_group_id": "223",
    "projectile_id": null,
    "check_obstacle": "t",
    "channeling_time": "0",
    "channeling_tick": "0",
    "channeling_mana": "0",
    "channeling_anim_id": null,
    "channeling_target_buff_id": null,
    "target_area_angle": "360",
    "ability_level": "10",
    "channeling_doodad_id": null,
    "cooldown_tag_id": null,
    "skill_controller_id": "--- :null\n",
    "repeat_count": "1",
    "repeat_tick": "100",
    "toggle_buff_id": null,
    "target_dead": "f",
    "channeling_buff_id": null,
    "reagent_corpse_status_id": "0",
    "source_dead": "f",
    "level_step": "10",
    "valid_height": "0",
    "target_valid_height": "0",
    "source_mount": "f",
    "stop_casting_on_big_hit": "f",
    "stop_channeling_on_big_hit": "f",
    "auto_learn": "t",
    "need_learn": "t",
    "mainhand_tool_id": null,
    "offhand_tool_id": null,
    "front_angle": "0",
    "mana_level_md": "2.88",
    "twohand_fire_anim_id": null,
    "unmount": "f",
    "damage_type_id": "2",
    "allow_to_prisoner": "f",
    "milestone_id": "5",
    "match_animation": "t",
    "plot_id": null,
    "use_anim_time": "f",
    "start_autoattack": "f",
    "consume_lp": "0",
    "source_stun": "f",
    "target_alive": "t",
    "web_desc": "\uC790\uC2E0\uC758 \uC8FC\uBCC0\uC5D0 \uBCF4\uD638\uB9C9\uC744 \uB9CC\uB4ED\uB2C8\uB2E4\r\n\uBCF4\uD638\uB9C9\uC740 \uB118\uC5B4\uC9D0 \uD6A8\uACFC\uB97C \uB9C9\uC544\uC8FC\uACE0 [\uD53C\uD574\uB7C9]\uC758 \uD53C\uD574\uB97C \uD761\uC218\uD558\uBA74 \uC0AC\uB77C\uC9C0\uBA70 \uBB3C\uB9AC \uBC29\uC5B4\uB3C4 [\uC99D\uAC00\uB7C9]\uC744 \uC99D\uAC00\uC2DC\uD0B5\uB2C8\uB2E4\r\n\uBCF4\uD638\uB9C9 \uC0C1\uD0DC\uC5D0\uC11C\uB294 \uC740\uC2E0 \uAC10\uC9C0 \uAC70\uB9AC\uAC00 50% \uC99D\uAC00\uB429\uB2C8\uB2E4",
    "target_water": "t",
    "use_skill_camera": "f",
    "controller_camera": "f",
    "camera_speed": "20",
    "controller_camera_speed": "80",
    "camera_max_distance": "5",
    "camera_duration": "1",
    "camera_acceleration": "0.2",
    "camera_slow_down_distance": "2",
    "camera_hold_z": "f",
    "casting_inc": "0",
    "casting_cancelable": "f",
    "casting_delayable": "t",
    "channeling_cancelable": "f",
    "target_offset_angle": "0",
    "target_offset_distance": "0",
    "actability_group_id": null,
    "plot_only": "f",
    "pitch_angle": "0",
    "skill_controller_at_end": "f",
    "end_skill_controller": "f",
    "string_instrument_start_anim_id": null,
    "percussion_instrument_start_anim_id": null,
    "tube_instrument_start_anim_id": null,
    "string_instrument_fire_anim_id": null,
    "percussion_instrument_fire_anim_id": null,
    "tube_instrument_fire_anim_id": null,
    "or_unit_reqs": "f",
    "default_gcd": "t",
    "show_target_casting_time": "t",
    "valid_height_edge_to_edge": "t",
    "link_equip_slot_id": "-1",
    "link_backpack_type_id": "1",
    "keep_mana_regen": "f",
    "crime_point": "0",
    "level_rule_no_consideration": "f",
    "use_weapon_cooldown_time": "f",
    "synergy_icon1_buffkind": "t",
    "synergy_icon1_id": "0",
    "synergy_icon2_buffkind": "t",
    "synergy_icon2_id": "0",
    "combat_dice_id": "4",
    "can_active_weapon_without_anim": "f",
    "custom_gcd": "0",
    "cancel_ongoing_buffs": "t",
    "cancel_ongoing_buff_exception_tag_id": null,
    "source_cannot_use_while_walk": "f",
    "source_mount_mate": "f",
    "match_animation_count": "f",
    "dual_wield_fire_anim_id": null,
    "auto_fire": "f",
    "check_terrain": "f",
    "target_only_water": "f",
    "source_not_swim": "f",
    "target_preoccupied": "f",
    "stop_channeling_on_start_skill": "f",
    "stop_casting_by_turn": "f",
    "target_my_npc": "f",
    "gain_life_point": "0",
    "target_fishing": "f",
    "source_no_slave": "f",
    "auto_reuse": "f",
    "auto_reuse_delay": "0",
    "source_not_collided": "f",
    "skill_points": "1",
    "doodad_hit_family": "0",
    "name_tr": "t",
    "desc_tr": "t",
    "web_desc_tr": "t",
    "sensitive_operation": "f",
    "first_reagent_only": "f",
    "source_alive": "t",
    "target_decal_radius": "0",
    "doodad_bundle_id": "0"
  },
  "localizations": {
    "desc": {
      "ko": "\uC790\uC2E0\uC758 \uC8FC\uBCC0\uC5D0 \uBCF4\uD638\uB9C9\uC744 \uB9CC\uB4ED\uB2C8\uB2E4\r\n#{buff_tooltip}\r\n\uBCF4\uD638\uB9C9 \uC0C1\uD0DC\uC5D0\uC11C\uB294 \uC740\uC2E0 \uAC10\uC9C0 \uAC70\uB9AC\uAC00 |cFFFF9C2750%|r \uC99D\uAC00\uB429\uB2C8\uB2E4",
      "en_us": "Creates a protective ward around the caster, this ability has been modified as a test. #{buff_tooltip} Increases stealth detection |cFFFF9C27\u002B200%|r.",
      "zh_cn": "",
      "ja": "",
      "ru": "",
      "zh_tw": "",
      "de": "Erzeugt einen Schutzbann um den Wirker. #{buff_tooltip} Erh\u00F6ht die Tarnungs-Erkennung |cFFFF9C27\u002B200%|r.",
      "fr": "Cr\u00E9e un glyphe protecteur autour du lanceur. #{buff_tooltip} Augmente la d\u00E9tection de la furtivit\u00E9 de |cFFFF9C27200%|r."
    },
    "name": {
      "ko": "\uBCF4\uD638\uB9C9",
      "en_us": "Insulating Lens",
      "zh_cn": "",
      "ja": "",
      "ru": "",
      "zh_tw": "",
      "de": "Isolierlinse",
      "fr": "Couche protectrice"
    },
    "web_desc": {
      "ko": "\uC790\uC2E0\uC758 \uC8FC\uBCC0\uC5D0 \uBCF4\uD638\uB9C9\uC744 \uB9CC\uB4ED\uB2C8\uB2E4\r\n\uBCF4\uD638\uB9C9\uC740 \uB118\uC5B4\uC9D0 \uD6A8\uACFC\uB97C \uB9C9\uC544\uC8FC\uACE0 [\uD53C\uD574\uB7C9]\uC758 \uD53C\uD574\uB97C \uD761\uC218\uD558\uBA74 \uC0AC\uB77C\uC9C0\uBA70 \uBB3C\uB9AC \uBC29\uC5B4\uB3C4 [\uC99D\uAC00\uB7C9]\uC744 \uC99D\uAC00\uC2DC\uD0B5\uB2C8\uB2E4\r\n\uBCF4\uD638\uB9C9 \uC0C1\uD0DC\uC5D0\uC11C\uB294 \uC740\uC2E0 \uAC10\uC9C0 \uAC70\uB9AC\uAC00 50% \uC99D\uAC00\uB429\uB2C8\uB2E4",
      "en_us": "Creates a protective ward around the caster.\nProtects against the Tripped effect, and increases Physical Defense \u002B[increase]. Disappears after absorbing [damage] damage.\nIncreases stealth detection distance \u002B50%.",
      "zh_cn": "",
      "ja": "",
      "ru": "",
      "zh_tw": "",
      "de": "Erzeugt einen Schutzbann um den Wirker.\nSch\u00FCtzt vor Stolpern und erh\u00F6ht die K\u00F6rperliche Abwehr \u002B[increase]. Verschwindet nach der Absorption von [damage] Schaden.\nErh\u00F6ht die Reichweite der Tarnungs-Erkennung \u002B50%.",
      "fr": "Cr\u00E9e un glyphe protecteur autour du lanceur.\nProt\u00E8ge contre l\u0027effet Tr\u00E9buchement et augmente la d\u00E9fense physique de [increase]. Dispara\u00EEt apr\u00E8s absorption de [damage]\u00A0points de d\u00E9g\u00E2ts.\nAugmente la d\u00E9tection de la furtivit\u00E9 de 50%."
    }
  },
  "localizationRowIds": {},
  "children": [
    {
      "table": "skill_effects",
      "ownerColumn": "skill_id",
      "sourceId": 274,
      "id": 274,
      "values": {
        "effect_id": "236",
        "weight": "0",
        "start_level": "10",
        "end_level": "19",
        "friendly": "t",
        "non_friendly": "t",
        "target_buff_tag_id": null,
        "target_nobuff_tag_id": null,
        "source_buff_tag_id": null,
        "source_nobuff_tag_id": null,
        "chance": "100",
        "front": "t",
        "back": "t",
        "target_npc_tag_id": null,
        "application_method_id": "1",
        "synergy_text": "f",
        "consume_source_item": "f",
        "consume_item_id": null,
        "consume_item_count": "1",
        "always_hit": "f",
        "item_set_id": "0",
        "interaction_success_hit": "f"
      }
    },
    {
      "table": "skill_effects",
      "ownerColumn": "skill_id",
      "sourceId": 1919,
      "id": 1919,
      "values": {
        "effect_id": "2090",
        "weight": "0",
        "start_level": null,
        "end_level": "29",
        "friendly": "t",
        "non_friendly": "t",
        "target_buff_tag_id": null,
        "target_nobuff_tag_id": null,
        "source_buff_tag_id": null,
        "source_nobuff_tag_id": null,
        "chance": "100",
        "front": "t",
        "back": "t",
        "target_npc_tag_id": null,
        "application_method_id": "1",
        "synergy_text": "f",
        "consume_source_item": "f",
        "consume_item_id": null,
        "consume_item_count": "1",
        "always_hit": "f",
        "item_set_id": "0",
        "interaction_success_hit": "f"
      }
    },
    {
      "table": "skill_effects",
      "ownerColumn": "skill_id",
      "sourceId": 1920,
      "id": 1920,
      "values": {
        "effect_id": "2091",
        "weight": "0",
        "start_level": "30",
        "end_level": "39",
        "friendly": "t",
        "non_friendly": "t",
        "target_buff_tag_id": null,